id,categoria,pregunta,respuesta,contexto
325,Medicamentos,¿Qué anticoagulante oral directo elijo en fibrilación auricular?,"En FA, si el riesgo embólico lo indica, se prefiere DOAC. No uses DOAC en válvula mecánica ni estenosis mitral moderada-severa; ahí corresponde AVK.","En fibrilación auricular, la anticoagulación oral se indica según riesgo tromboembólico y se prefieren DOAC frente a antagonistas de vitamina K en la mayoría de pacientes elegibles. Los DOAC no deben utilizarse en válvulas mecánicas ni en estenosis mitral moderada-severa; la dosis debe respetar criterios específicos para evitar infradosificación."
326,Medicamentos,¿Cómo sé si apixabán va a 5 mg o a dosis reducida?,"No lo dosifiques “de memoria” sin datos. En FA suele ser 5 mg cada 12 h, con reducción a 2,5 mg cada 12 h si cumple criterios específicos de edad, peso y creatinina.","No lo dosifiques “de memoria” sin datos. En FA suele ser 5 mg cada 12 h, con reducción a 2,5 mg cada 12 h si cumple criterios específicos de edad, peso y creatinina. Apixabán se usa en fibrilación auricular no valvular y tromboembolismo, con dosis determinada por indicación y criterios clínicos. Antes de prescribirlo se revisan función renal, edad, peso, creatinina, interacciones y riesgo de sangrado; la dosis reducida solo procede si se cumplen criterios."
327,Medicamentos,¿Puedo darle rivaroxabán a este paciente o hay que ajustarlo?,En FA suele ser 20 mg una vez al día con comida si función renal adecuada; se reduce con insuficiencia renal según ficha técnica. Revisa filtrado e interacciones.,"Rivaroxabán puede usarse en fibrilación auricular no valvular o tromboembolismo si la función renal y el perfil hemorrágico lo permiten. Deben comprobarse indicación, filtrado glomerular, interacciones, adherencia con la toma con comida en FA y contraindicaciones como válvula mecánica o estenosis mitral moderada-severa."
328,Medicamentos,¿cuándo uso dabigatran?,"Puede usarse si la función renal lo permite. Vigila dispepsia, sangrado, edad avanzada, filtrado bajo e interacciones; ajusta dosis según ficha técnica.","Dabigatrán es un inhibidor directo de trombina usado en FA no valvular. Su uso depende de función renal, edad, riesgo hemorrágico e interacciones con glicoproteína P."
329,Medicamentos,¿qué contraindicaciones tiene warfarina válvula mecánica?,Con válvula mecánica no uses DOAC. Necesita AVK con INR objetivo según tipo y posición de válvula y factores de riesgo.,Los pacientes con válvula mecánica requieren anticoagulación con antagonistas de vitamina K. Los DOAC no están indicados en válvulas mecánicas.
330,Medicamentos,"triple terapia, ¿qué vigilo?","Triple terapia el menor tiempo posible y solo si el riesgo isquémico lo justifica. Después suele pasarse a anticoagulante más un antiagregante, individualizando.","En pacientes con FA y SCA/PCI, la combinación de anticoagulante y antiagregantes aumenta sangrado. Las guías recomiendan minimizar duración de triple terapia y adaptar a riesgo isquémico y hemorrágico."
331,Medicamentos,"mi paciente toma antihipertensivos inicio, ¿qué problema puede dar?","Tras confirmar HTA, decide por nivel de presión y riesgo global. A menudo se inicia combinación de dos fármacos a dosis bajas, salvo fragilidad, bajo riesgo o situaciones especiales.","En hipertensión, las guías ESC favorecen tratamiento basado en riesgo cardiovascular, cifras confirmadas y daño de órgano. La combinación en un solo comprimido mejora adherencia cuando está indicada."
332,Medicamentos,¿IECA embarazo sirve en urgencias?,"No uses IECA/ARA-II/ARNI en embarazo. Si la paciente puede estar embarazada o planifica gestación, cambia a opciones seguras y coordina manejo.","IECA, ARA-II y ARNI están contraindicados en embarazo por riesgo fetal. En mujeres con posibilidad de embarazo se debe revisar anticoncepción y alternativas seguras."
333,Medicamentos,¿qué hago si necesita amlodipino edema?,"Amlodipino puede dar edema de tobillos. Si molesta, ajusta dosis o combina/cambia fármaco; no asumas que todo edema es insuficiencia cardiaca.","Los calcioantagonistas dihidropiridínicos como amlodipino son eficaces en hipertensión y angina, pero pueden causar edema maleolar, rubor o cefalea. El edema no siempre responde a diuréticos."
334,Medicamentos,"hidroclorotiazida clortalidona en cardiologia, ¿para qué?","Sirven para HTA, sobre todo en combinación. Controla sodio, potasio, función renal, uricemia y glucosa, especialmente en ancianos.","Los diuréticos tiazídicos o similares son fármacos de primera línea en hipertensión, con vigilancia de sodio, potasio, ácido úrico, glucosa y función renal."
335,Protocolos,que hago si tengo stemi activar hemodinamica,"Activa código infarto/hemodinámica si hay STEMI o equivalente. La angioplastia primaria es preferente; si no llega a tiempo y no hay contraindicaciones, valora fibrinólisis según tiempos.","En IAM con elevación persistente del ST, la estrategia preferida es angioplastia primaria dentro de tiempos recomendados. Si no es posible en plazo adecuado, se considera fibrinólisis si no hay contraindicación y el inicio de síntomas es compatible."
336,Protocolos,protocolo de SCASEST invasivo,"Si hay inestabilidad, dolor refractario, arritmias graves, shock o cambios ECG importantes, estrategia inmediata. Si alto riesgo por troponina/GRACE, coronariografía temprana.","En SCASEST, la estrategia invasiva se decide por riesgo: inestabilidad, dolor recurrente, cambios dinámicos del ST, troponina, GRACE y comorbilidad. Los muy alto riesgo requieren manejo inmediato."
337,Protocolos,¿cuándo ingreso por algoritmo troponina?,"Usa protocolo 0/1 h o 0/2 h si disponible, siempre con ECG y clínica. Si dolor muy reciente o alta sospecha, repite y observa aunque la primera sea baja.",Los algoritmos con troponina de alta sensibilidad 0/1 h o 0/2 h ayudan a descartar o confirmar IAM cuando se interpretan con clínica y ECG. Un resultado aislado no sustituye el juicio clínico.
338,Protocolos,¿cuándo activo dolor torácico triaje?,"Primero ECG rápido y constantes. Si hay signos de SCA, disección, TEP, shock o hipoxemia, se prioriza manejo urgente; no esperes a la analítica para actuar.","El dolor torácico agudo requiere valorar constantes, ECG en minutos, riesgo vital y diagnósticos alternativos como disección, embolia pulmonar, pericarditis o neumotórax."
339,Protocolos,"ingreso por síncope, ¿cuál es el algoritmo?","Ingresa/monitoriza si hay datos de alto riesgo. Si es vasovagal claro, ECG normal y sin cardiopatía, puede manejarse ambulatorio con educación y seguimiento.","El síncope se ingresa o monitoriza si hay criterios de alto riesgo: cardiopatía, ECG anormal, síncope de esfuerzo o decúbito, palpitaciones previas, hipotensión persistente o sospecha de arritmia."
340,Protocolos,¿cómo manejo FA inestable cardioversión en guardia?,"Si la FA está causando shock, edema pulmonar o isquemia, cardioversión sincronizada urgente. Después se ordena anticoagulación y estudio de causa.","En fibrilación auricular con inestabilidad hemodinámica, isquemia, edema agudo de pulmón o shock, la cardioversión eléctrica sincronizada urgente está indicada. La anticoagulación no debe retrasar salvar la vida."
341,Protocolos,"tengo FA estable frecuencia, ¿primer paso?","Si está estable, controla frecuencia, busca desencadenante y calcula riesgo embólico. Ritmo o frecuencia se decide según síntomas, tiempo de evolución, IC y recurrencias.","En FA estable, el control inicial puede centrarse en frecuencia, síntomas, comorbilidades y anticoagulación según riesgo. La estrategia de ritmo se individualiza por síntomas, duración, IC y preferencia."
342,Protocolos,¿qué criterios uso para cardioversión FA anticoagulación?,"Si no sabes cuánto lleva en FA, no cardiovertir electivamente sin cubrir tromboembolia. Anticoagulación o ETE según caso; si está inestable, se cardioverte igual y se anticoagula.","Para cardioversión de FA, el riesgo embólico depende de duración y perfil del paciente. Si FA dura más de 24-48 h o es incierta, se requiere anticoagulación adecuada o ecocardiograma transesofágico según estrategia."
343,Protocolos,"ablación FA, ¿derivo o manejo aquí?","Se plantea si FA sintomática recurre pese a fármacos o si se busca ritmo en pacientes seleccionados. No olvides peso, apnea del sueño, HTA, alcohol y anticoagulación.","La ablación con catéter se considera para control de ritmo en FA sintomática, especialmente si falla tratamiento antiarrítmico o en algunos casos como primera línea. Es importante tratar factores de riesgo y comorbilidades."
344,Protocolos,¿hay que monitorizar en IC aguda manejo?,"Clasifica rápido: ¿congestionado?, ¿hipoperfundido?, ¿hipoxémico? Trata desencadenante, diurético si congestión, oxígeno si lo necesita y soporte si shock.","La insuficiencia cardiaca aguda se maneja evaluando congestión y perfusión, identificando desencadenantes como SCA, arritmia, infección o crisis hipertensiva. El tratamiento incluye oxígeno si hipoxemia, diuréticos y soporte según perfil."
345,Protocolos,¿qué hago si tengo IC crónica alta?,"No dejar solo furosemida. En HFrEF busca los cuatro pilares si tolera: ARNI/IECA/ARA-II, beta, MRA y SGLT2, con controles de presión, riñón y potasio.","En insuficiencia cardiaca con FEVI reducida, el tratamiento modificador de pronóstico incluye ARNI/IECA/ARA-II, betabloqueante, antagonista mineralocorticoide e inhibidor SGLT2, titulado según tolerancia."
346,Protocolos,protocolo de alta por IC,"Dale alta solo si está estable, sin congestión importante, con tratamiento claro, peso objetivo, educación y cita precoz. Revisa riñón, potasio y adherencia.","Antes del alta por insuficiencia cardiaca se debe asegurar estabilidad clínica, euvolemia, plan de tratamiento, educación, control precoz y ajuste de fármacos modificadores de pronóstico."
347,Protocolos,¿cuándo ingreso por HTA confirmar diagnóstico?,"No diagnostiques por una sola toma aislada salvo urgencia. Confirma con mediciones repetidas, AMPA/MAPA, y calcula riesgo global y daño de órgano.","La hipertensión debe confirmarse con mediciones repetidas y preferentemente AMPA o MAPA cuando sea posible. La evaluación inicial busca daño de órgano, riesgo cardiovascular y causas secundarias si hay sospecha."
348,Protocolos,cuándo activo emergencia hipertensiva protocolo,"Si hay daño agudo de órgano, monitorización e IV. El objetivo y velocidad dependen del cuadro: disección no se maneja igual que ictus o edema pulmonar.","La emergencia hipertensiva exige ingreso y descenso controlado de presión con fármacos intravenosos según órgano afectado. La disección aórtica, el edema pulmonar y el SCA tienen prioridades específicas."
349,Protocolos,"valvulopatía eco, ¿cuál es el algoritmo?","Pide eco si hay soplo significativo, síntomas, cambio clínico o sospecha de valvulopatía. La decisión no es por el soplo solo, sino por severidad y repercusión.","La ecocardiografía es prueba central para diagnosticar y cuantificar valvulopatías, evaluar función ventricular, presiones pulmonares y repercusión. Los síntomas y severidad guían seguimiento o intervención."
350,Protocolos,¿cómo manejo estenosis aórtica derivación en guardia?,"Si es severa y sintomática, deriva a equipo valvular. Ajustar diurético puede aliviar, pero la solución es intervención si es candidato.","La estenosis aórtica severa sintomática requiere valoración por Heart Team para TAVI o cirugía según edad, riesgo, anatomía y preferencias. El tratamiento médico no corrige la obstrucción."
351,Protocolos,"tengo endocarditis protocolo, ¿primer paso?","Toma hemocultivos antes de antibiótico si está estable, pide eco y busca complicaciones. Prótesis, dispositivo o S. aureus suben mucho la sospecha.","La sospecha de endocarditis requiere hemocultivos, ecocardiografía y valoración multidisciplinar. En prótesis valvular, dispositivos o bacteriemia por Staphylococcus aureus, el umbral para estudio debe ser bajo."
352,Protocolos,¿que criterios uso para rcp basica?,"Si no responde y no respira normal, inicia compresiones y pide desfibrilador. Compresiones fuertes, rápidas, mínimas interrupciones y desfibrilar cuanto antes si corresponde.","En parada cardiaca, la supervivencia depende de reconocimiento precoz, llamada de ayuda, compresiones torácicas de calidad y desfibrilación temprana si ritmo desfibrilable. No se debe retrasar la RCP por comprobar demasiado."
353,Protocolos,"RCP ritmo desfibrilable, ¿derivo o manejo aquí?",FV/TV sin pulso: descarga cuanto antes y sigue RCP. No pierdas tiempo buscando pulso después de cada descarga; reanuda compresiones.,"La fibrilación ventricular y la taquicardia ventricular sin pulso son ritmos desfibrilables. El algoritmo prioriza descarga, RCP inmediata posterior, adrenalina y antiarrítmico según ciclos."
354,Protocolos,¿hay que monitorizar en RCP asistolia?,"Asistolia no se desfibrila. Haz RCP, adrenalina según algoritmo y busca las H y T: hipoxia, hipovolemia, potasio, taponamiento, trombosis, neumotórax, toxinas.","La asistolia y la actividad eléctrica sin pulso no son ritmos desfibrilables. El manejo se centra en RCP de calidad, adrenalina y búsqueda de causas reversibles."
355,Protocolos,¿qué hago si tengo marcapasos indicación?,"Si bloqueo avanzado o bradicardia sintomática no reversible, marcapasos. Si es por fármaco, hiperpotasemia o isquemia reversible, corrige primero.","El marcapasos está indicado en bradicardias sintomáticas persistentes o bloqueos AV avanzados no reversibles. Antes se deben excluir causas corregibles como fármacos, isquemia o alteraciones metabólicas."
356,Protocolos,protocolo de DAI indicación,DAI si tuvo TV/FV no reversible o si FEVI sigue muy reducida pese a tratamiento óptimo y cumple criterios. No se decide en fase aguda sin reevaluación cuando toca.,El desfibrilador implantable se usa en prevención secundaria tras arritmia ventricular maligna no reversible y en prevención primaria en pacientes seleccionados con FEVI reducida pese a tratamiento óptimo.
357,Protocolos,¿cuándo ingreso por TRC indicación?,"Si HFrEF, síntomas y QRS ancho tipo BRI, piensa en TRC. Necesita ECG, FEVI y tratamiento médico optimizado antes de decidir.","La terapia de resincronización se considera en insuficiencia cardiaca con FEVI reducida, QRS ancho especialmente bloqueo de rama izquierda, síntomas pese a tratamiento y criterios eléctricos específicos."
358,Protocolos,¿cuándo activo cateterismo estable?,"Si angina estable de bajo riesgo, primero estratifica y trata. Cateterismo si alto riesgo, síntomas refractarios, isquemia importante o sospecha anatómica relevante.","En enfermedad coronaria crónica, la indicación de coronariografía depende de síntomas, isquemia, riesgo, función ventricular y respuesta a tratamiento. No todo dolor estable requiere cateterismo urgente."
359,Protocolos,"eco en urgencias, ¿cuál es el algoritmo?","Pide eco urgente si cambia la conducta inmediata: shock, taponamiento, VD en TEP, soplo nuevo con edema pulmonar, complicación post-IAM o valvulopatía aguda.","El ecocardiograma urgente está indicado si hay shock, sospecha de complicación mecánica, taponamiento, valvulopatía aguda, insuficiencia cardiaca grave o embolia pulmonar de alto riesgo."
360,Protocolos,¿cómo manejo riesgo cardiovascular en guardia?,"Calcula riesgo global, no mires solo LDL o presión. SCORE2/SCORE2-OP ayuda, pero diabetes, ERC o enfermedad cardiovascular ya ponen al paciente en riesgo alto o muy alto.","La estratificación de riesgo cardiovascular integra edad, sexo, presión, lípidos, tabaquismo, diabetes, enfermedad renal, antecedentes y daño de órgano. En Europa se usan herramientas SCORE2/SCORE2-OP según edad y región."
361,Protocolos,"tengo anticoagular FA score, primer paso",Calcula CHA2DS2-VA. Si es 0 suele no anticoagularse; si es 1 se considera; si es ≥2 se recomienda salvo contraindicación.,"La guía ESC 2024 simplifica la valoración del riesgo tromboembólico en FA con CHA2DS2-VA, retirando el sexo como punto. La anticoagulación se recomienda con riesgo elevado y se considera con riesgo intermedio."
362,Protocolos,¿qué criterios uso para sangrado HASBLED?,HAS-BLED alto no significa “no anticoagular”. Significa corregir factores de sangrado y vigilar más estrechamente.,"Las escalas de sangrado ayudan a identificar factores modificables, pero no deben usarse solas para negar anticoagulación si el riesgo embólico es alto. Deben corregirse HTA, alcohol, AINE, anemia y mal control de INR."
363,Protocolos,"taquicardia QRS ancho, ¿derivo o manejo aquí?","QRS ancho: piensa TV primero. Si está inestable, cardioversión sincronizada; si estable, ECG, experto y evita fármacos que puedan empeorar una TV.","Toda taquicardia regular de QRS ancho debe considerarse ventricular hasta demostrar lo contrario, especialmente en pacientes con cardiopatía estructural. La inestabilidad exige cardioversión sincronizada."
364,Protocolos,¿hay que monitorizar en bradicardia inestable?,"Si la bradicardia da bajo gasto, actúa: atropina si procede, prepara marcapasos transcutáneo y trata causa reversible. Monitoriza y pide ayuda.","La bradicardia con signos de shock, síncope, dolor isquémico o insuficiencia cardiaca requiere tratamiento urgente. Si no responde a medidas iniciales, se usa estimulación transcutánea o fármacos vasoactivos."
365,Protocolos,¿qué hago si tengo pericarditis ingreso?,"Ingresa si hay factores de alto riesgo: fiebre, derrame grande, taponamiento, inmunosupresión, anticoagulación, trauma o mala evolución. Si no, ambulatorio con control.","La pericarditis puede manejarse ambulatoria si es de bajo riesgo, pero requiere ingreso si hay fiebre alta, curso subagudo, derrame grande, taponamiento, inmunosupresión, trauma, anticoagulación o mala respuesta."
366,Protocolos,protocolo de miocarditis deporte,"No debe hacer deporte intenso con miocarditis activa. Reevalúa antes de volver: síntomas, ECG, troponina, función ventricular y arritmias.","En miocarditis se recomienda evitar ejercicio intenso durante la fase aguda y hasta recuperación, porque aumenta riesgo arrítmico. El retorno al deporte requiere reevaluación clínica, ECG, imagen y biomarcadores según caso."
367,Protocolos,¿cuándo ingreso por anticoagulante perioperatorio?,"No hagas puente automáticamente. Define riesgo del procedimiento, filtrado renal, último DOAC y riesgo trombótico; en muchos DOAC basta pausa programada.","El manejo perioperatorio de anticoagulantes depende de riesgo trombótico, riesgo hemorrágico del procedimiento, función renal y tipo de anticoagulante. El puente con heparina no es rutinario para DOAC."
368,Protocolos,¿cuándo activo preoperatorio cardiaco?,"No pidas pruebas por rutina. Si hay síntomas activos, mala capacidad funcional o cirugía de alto riesgo, estratifica; pide eco/prueba de isquemia solo si cambiará manejo.","La evaluación cardiaca preoperatoria estima riesgo del paciente, riesgo de cirugía, capacidad funcional y presencia de enfermedad cardiovascular activa. Las pruebas se piden si cambian la conducta."
369,Protocolos,"dolor toracico alta segura, ¿cual es el algoritmo?","Alta solo si bajo riesgo real: clínica tranquilizadora, ECG sin isquemia y troponinas según protocolo negativas. Si la sospecha sigue alta, observa o ingresa.","El alta de urgencias por dolor torácico requiere bajo riesgo clínico, ECG sin cambios isquémicos, troponinas negativas según algoritmo y ausencia de diagnósticos alternativos graves."
370,Protocolos,¿cómo manejo telemetría ingreso en guardia?,"Pon telemetría si hay SCA, síncope sospechoso, arritmia, QT largo, potasio alterado o riesgo de bloqueo. Retírala cuando el riesgo agudo baje.","La monitorización electrocardiográfica se indica en SCA, arritmias significativas, síncope de alto riesgo, trastornos electrolíticos graves o fármacos proarrítmicos. La duración depende del riesgo y evolución."
371,Protocolos,"tengo MAPA AMPA, ¿primer paso?","Usa AMPA/MAPA si dudas del diagnóstico o control. Sirve para bata blanca, enmascarada y ajuste de tratamiento con medidas más reales que consulta.","La MAPA y la AMPA ayudan a confirmar hipertensión, detectar bata blanca, hipertensión enmascarada y evaluar control. Deben usarse dispositivos validados y técnica correcta."
372,Protocolos,¿qué criterios uso para profilaxis endocarditis?,"No todos necesitan profilaxis. Solo alto riesgo, como prótesis valvular, endocarditis previa o ciertas cardiopatías, y en procedimientos dentales de riesgo.",La profilaxis antibiótica de endocarditis se reserva para pacientes de alto riesgo sometidos a procedimientos dentales de riesgo. No se recomienda de forma amplia para cualquier soplo o valvulopatía leve.
373,Protocolos,"TAVI cirugía, ¿derivo o manejo aquí?","No es “TAVI para todos”. El Heart Team decide según edad, riesgo, anatomía, expectativa de vida y preferencias.","La elección entre TAVI y cirugía valvular depende de edad, riesgo quirúrgico, anatomía, durabilidad esperada, comorbilidades y decisión del Heart Team."
374,Protocolos,qué hago si tengo STEMI activar hemodinámica,"Activa código infarto/hemodinámica si hay STEMI o equivalente. La angioplastia primaria es preferente; si no llega a tiempo y no hay contraindicaciones, valora fibrinólisis según tiempos.","En IAM con elevación persistente del ST, la estrategia preferida es angioplastia primaria dentro de tiempos recomendados. Si no es posible en plazo adecuado, se considera fibrinólisis si no hay contraindicación y el inicio de síntomas es compatible."
375,Protocolos,protocolo de SCASEST invasivo ahora,"Si hay inestabilidad, dolor refractario, arritmias graves, shock o cambios ECG importantes, estrategia inmediata. Si alto riesgo por troponina/GRACE, coronariografía temprana.","En SCASEST, la estrategia invasiva se decide por riesgo: inestabilidad, dolor recurrente, cambios dinámicos del ST, troponina, GRACE y comorbilidad. Los muy alto riesgo requieren manejo inmediato."
376,Protocolos,¿cuándo ingreso por algoritmo troponina ahora?,"Usa protocolo 0/1 h o 0/2 h si disponible, siempre con ECG y clínica. Si dolor muy reciente o alta sospecha, repite y observa aunque la primera sea baja.",Los algoritmos con troponina de alta sensibilidad 0/1 h o 0/2 h ayudan a descartar o confirmar IAM cuando se interpretan con clínica y ECG. Un resultado aislado no sustituye el juicio clínico.
377,Protocolos,¿cuándo activo dolor torácico triaje ahora?,"Primero ECG rápido y constantes. Si hay signos de SCA, disección, TEP, shock o hipoxemia, se prioriza manejo urgente; no esperes a la analítica para actuar.","El dolor torácico agudo requiere valorar constantes, ECG en minutos, riesgo vital y diagnósticos alternativos como disección, embolia pulmonar, pericarditis o neumotórax."
378,Protocolos,"ingreso por síncope, ¿cuál es el algoritmo ahora?","Ingresa/monitoriza si hay datos de alto riesgo. Si es vasovagal claro, ECG normal y sin cardiopatía, puede manejarse ambulatorio con educación y seguimiento.","El síncope se ingresa o monitoriza si hay criterios de alto riesgo: cardiopatía, ECG anormal, síncope de esfuerzo o decúbito, palpitaciones previas, hipotensión persistente o sospecha de arritmia."
379,Protocolos,¿cómo manejo FA inestable cardioversión en guardia ahora?,"Si la FA está causando shock, edema pulmonar o isquemia, cardioversión sincronizada urgente. Después se ordena anticoagulación y estudio de causa.","En fibrilación auricular con inestabilidad hemodinámica, isquemia, edema agudo de pulmón o shock, la cardioversión eléctrica sincronizada urgente está indicada. La anticoagulación no debe retrasar salvar la vida."
380,Protocolos,"tengo FA estable frecuencia, ¿primer paso ahora?","Si está estable, controla frecuencia, busca desencadenante y calcula riesgo embólico. Ritmo o frecuencia se decide según síntomas, tiempo de evolución, IC y recurrencias.","En FA estable, el control inicial puede centrarse en frecuencia, síntomas, comorbilidades y anticoagulación según riesgo. La estrategia de ritmo se individualiza por síntomas, duración, IC y preferencia."
381,Protocolos,¿qué criterios uso para cardioversión FA anticoagulación ahora?,"Si no sabes cuánto lleva en FA, no cardiovertir electivamente sin cubrir tromboembolia. Anticoagulación o ETE según caso; si está inestable, se cardioverte igual y se anticoagula.","Para cardioversión de FA, el riesgo embólico depende de duración y perfil del paciente. Si FA dura más de 24-48 h o es incierta, se requiere anticoagulación adecuada o ecocardiograma transesofágico según estrategia."
382,Protocolos,"ablación FA, ¿derivo o manejo aquí ahora?","Se plantea si FA sintomática recurre pese a fármacos o si se busca ritmo en pacientes seleccionados. No olvides peso, apnea del sueño, HTA, alcohol y anticoagulación.","La ablación con catéter se considera para control de ritmo en FA sintomática, especialmente si falla tratamiento antiarrítmico o en algunos casos como primera línea. Es importante tratar factores de riesgo y comorbilidades."
383,Protocolos,¿hay que monitorizar en IC aguda manejo ahora?,"Clasifica rápido: ¿congestionado?, ¿hipoperfundido?, ¿hipoxémico? Trata desencadenante, diurético si congestión, oxígeno si lo necesita y soporte si shock.","La insuficiencia cardiaca aguda se maneja evaluando congestión y perfusión, identificando desencadenantes como SCA, arritmia, infección o crisis hipertensiva. El tratamiento incluye oxígeno si hipoxemia, diuréticos y soporte según perfil."
